{"canonical_repository_id":"dce8dbc3cde106047631317a09257c23ee5eab4d9ece5f88d52108ae384a8503","completed_at":"2026-09-03T01:39:14Z","execution":"manual-execution-of-scheduled-target","expired_pending_entries":2,"full_read_data_check":"zero-errors","local_service_result":"success","nfs_snapshot_id":"c25237d906ea7f78b052f3131e8737aa39be179228743a95404276e3efb5c0e0","pending_entries":0,"policy_sha256":"81b1f0dd0f1a2fd596c13ee3b6a79e7bb181ae5d0b80e3e942ab69f96d77a6ff","proton_copied_snapshots":1,"proton_service_result":"success","proton_snapshot_id":"4ae03d04658d45a25534008a26b642722f35d08839e3fb4e3c0e4d8de31760d2","rclone_sha256":"acd2c7aca2996c884a8cd0012b27d74213bc7d02c514d9711166b5023e51ca49","snapshot_count":2,"source_snapshot_id":"3877b600d37c2f2003af9e765f137da8175fee473fda7b1b2407c97b1898de76","structural_check":"zero-errors","timers":[{"active":"active","unit":"home-lab-restic-daily.timer","unit_file":"enabled"},{"active":"active","unit":"home-lab-restic-maintenance.timer","unit_file":"enabled"}],"version":1}
